<?xml version="1.0" encoding="UTF-8"?>
<xs:schema xmlns:xs="http://www.w3.org/2001/XMLSchema">

    <xs:element name="student">
        <xs:complexType>
            <xs:sequence>
                <xs:element name="fullname" type="xs:string"/>
                <xs:element name="age" type="xs:integer"/>
                <xs:element name="address" type="xs:string"/>
                <xs:element name="course" type="xs:string"/>
                <xs:element name="yearlevel" type="xs:string"/>
                <xs:element name="studentID" type="xs:string"/>
                <xs:element name="email" type="xs:string"/>
                <xs:element name="phone" type="xs:string"/>

                <xs:element name="skills">
                    <xs:complexType>
                        <xs:sequence>
                            <xs:element name="skill" type="xs:string" maxOccurs="unbounded"/>
                        </xs:sequence>
                    </xs:complexType>
                </xs:element>

                <xs:element name="hobbies">
                    <xs:complexType>
                        <xs:sequence>
                            <xs:element name="hobby" type="xs:string" maxOccurs="unbounded"/>
                        </xs:sequence>
                    </xs:complexType>
                </xs:element>

                <xs:element name="motto" type="xs:string"/>
            </xs:sequence>
        </xs:complexType>
    </xs:element>

</xs:schema>
